### ISSUE TITLE
Checkpoint 4，webget超时

### ISSUE THREAD

**Issue by shuiyihang** [dongfangzhou1108/minnow#1]
我在做minnow Checkpoint 4: interoperating in the world任务时，./build/apps/webget cs144.keithw.org /nph-hasher/xyzzy显示超时。

运行./build/apps/webget cs144.keithw.org /nph-hasher/xyzzy，另一个终端使用 sudo tshark -i tun144 捕获到：

> Running as user "root" and group "root". This could be dangerous.
Capturing on 'tun144'
 ** (tshark:3876) 17:16:09.409432 [Main MESSAGE] -- Capture started.
 ** (tshark:3876) 17:16:09.409612 [Main MESSAGE] -- File: "/tmp/wireshark_tun144T1UN42.pcapng"
    1 0.000000000 169.254.144.9 → 104.196.238.229 TCP 40 6561 → 80 [SYN] Seq=0 Win=64000 Len=0
    2 0.107949394 169.254.144.9 → 104.196.238.229 TCP 40 [TCP Retransmission] [TCP Port numbers reused] 6561 → 80 [SYN] Seq=0 Win=64000 Len=0
    3 0.310828462 169.254.144.9 → 104.196.238.229 TCP 40 [TCP Retransmission] [TCP Port numbers reused] 6561 → 80 [SYN] Seq=0 Win=64000 Len=0
    4 0.712103146 169.254.144.9 → 104.196.238.229 TCP 40 [TCP Retransmission] [TCP Port numbers reused] 6561 → 80 [SYN] Seq=0 Win=64000 Len=0
    5 1.515345781 169.254.144.9 → 104.196.238.229 TCP 40 [TCP Retransmission] [TCP Port numbers reused] 6561 → 80 [SYN] Seq=0 Win=64000 Len=0
    6 3.115858964 169.254.144.9 → 104.196.238.229 TCP 40 [TCP Retransmission] [TCP Port numbers reused] 6561 → 80 [SYN] Seq=0 Win=64000 Len=0
    7 6.324719035 169.254.144.9 → 104.196.238.229 TCP 40 [TCP Retransmission] [TCP Port numbers reused] 6561 → 80 [SYN] Seq=0 Win=64000 Len=0
    8 11.623763628 fe80::db8c:827:2715:572a → ff02::2      ICMPv6 48 Router Solicitation
    9 12.728604683 169.254.144.9 → 104.196.238.229 TCP 40 [TCP Retransmission] [TCP Port numbers reused] 6561 → 80 [SYN] Seq=0 Win=64000 Len=0
^C9 packets captured

但是我使用tcp_native和tcp_ipv4，他们是可以正常通信的，我的系统是ubuntu22.04
请问你有遇到这种问题吗
